{
  "decision_id": "dec-person-sarah-opp-servicenow-principal-declining-policy-default",
  "decision_model_version": "1.0.0",
  "action": "NETWORK_FIRST",
  "summary": "Action NETWORK_FIRST based on weighted claim evidence",
  "drivers": [
    {
      "direction": "positive",
      "message": "remote_alignment -> +0.30",
      "claim_ref": "cl-remote-positive"
    },
    {
      "direction": "positive",
      "message": "skill_match -> +0.40",
      "claim_ref": "cl-skill-servicenow-match"
    },
    {
      "direction": "negative",
      "message": "seniority_alignment -> -0.30",
      "claim_ref": "cl-seniority-negative"
    }
  ]
}